### ISSUE TITLE
e2e: systemctl stop bluechi-agent is not working

### ISSUE THREAD

**Issue by dougsland** [containers/qm#338]
## Describe the bug

My test environment contain 4 nodes, 1 controller and 3 additional agent nodes.

Let's check the current status of the agent:
```
[root@node2 ~]# systemctl status bluechi-agent
● bluechi-agent.service - BlueChi systemd service controller agent daemon
     Loaded: loaded (/usr/lib/systemd/system/bluechi-agent.service; enabled; preset: disabled)
     Active: active (running) since Mon 2024-01-15 20:55:23 UTC; 12s ago
       Docs: man:bluechi-agent(1)
             man:bluechi-agent.conf(5)
   Main PID: 528 (bluechi-agent)
      Tasks: 1 (limit: 1638)
     Memory: 472.0K
        CPU: 4ms
     CGroup: /system.slice/bluechi-agent.service
             └─528 /usr/libexec/bluechi-agent

Jan 15 20:55:23 node2 systemd[1]: Started BlueChi systemd service controller agent daemon.
Jan 15 20:55:23 node2 bluechi-agent[528]: Starting bluechi-agent 0.7.0-0.202311161313.git
Jan 15 20:55:23 node2 bluechi-agent[528]: Connecting to manager on tcp:host=10.90.0.2,port=842
Jan 15 20:55:23 node2 bluechi-agent[528]: Connected to manager as 'node2'
```

Ok running, now let's stop the service and check the output:
```
[root@node2 ~]# systemctl stop bluechi-agent
[root@node2 ~]# systemctl status bluechi-agent
○ bluechi-agent.service - BlueChi systemd service controller agent daemon
     Loaded: loaded (/usr/lib/systemd/system/bluechi-agent.service; enabled; preset: disabled)
     Active: inactive (dead) since Mon 2024-01-15 20:55:40 UTC; 1s ago
   Duration: 17.433s
       Docs: man:bluechi-agent(1)
             man:bluechi-agent.conf(5)
    Process: 528 ExecStart=/usr/libexec/bluechi-agent (code=exited, status=0/SUCCESS)
   Main PID: 528 (code=exited, status=0/SUCCESS)
        CPU: 5ms
```

Great, inactive, however, I still see the process there:
```
[root@node2 ~]# ps aux | grep -i bluechi-agent
root        2231  0.0  0.0   6500  3520 ?        Ss   20:56   0:00 /usr/libexec/bluechi-agent
root        2636  0.0  0.0   3900  2240 pts/0    S+   21:01   0:00 grep --color=auto -i bluechi-agent
```

still see active in the tcpdump as well (running in the controller):
```
[root@control ~]# sudo tcpdump host 10.90.0.4 and port 842
dropped privs to tcpdump
tcpdump: verbose output suppressed, use -v[v]... for full protocol decode
listening on eth0, link-type EN10MB (Ethernet), snapshot length 262144 bytes
21:05:54.403695 IP control.842 > 10.90.0.4.54982: Flags [.], ack 3846430692, win 501, options [nop,nop,TS val 535797777 ecr 166244159], length 0
21:05:54.403712 IP 10.90.0.4.54982 > control.842: Flags [.], ack 1, win 535, options [nop,nop,TS val 166245223 ecr 535796713], length 0
21:05:54.403720 IP control.842 > 10.90.0.4.54982: Flags [.], ack 1, win 501, options [nop,nop,TS val 535797777 ecr 166244159], length 0
21:05:54.403747 IP 10.90.0.4.54982 > control.842: Flags [.], ack 1, win 535, options [nop,nop,TS val 166245223 ecr 535797777], length 0
21:05:54.583836 IP 10.90.0.4.54982 > control.842: Flags [P.], seq 1:137, ack 1, win 535, options [nop,nop,TS val 166245403 ecr 535797777], length 136
21:05:54.583848 IP control.842 > 10.90.0.4.54982: Flags [.], ack 137, win 501, options [nop,nop,TS val 535797957 ecr 166245403], length 0
21:05:55.587707 IP 10.90.0.4.54982 > control.842: Flags [.], ack 1, win 535, options [nop,nop,TS val 166246407 ecr 535797957], length 0
21:05:55.587715 IP control.842 > 10.90.0.4.54982: Flags [.], ack 137, win 501, options [nop,nop,TS val 535798961 ecr 166245403], length 0
21:05:55.588301 IP control.842 > 10.90.0.4.54982: Flags [.], ack 137, win 501, options [nop,nop,TS val 535798961 ecr 166245403], length 0
21:05:55.588337 IP 10.90.0.4.54982 > control.842: Flags [.], ack 1, win 535, options [nop,nop,TS val 166246407 ecr 535798961], length 0
^C
10 packets captured
10 packets received by filter
0 packets dropped by kernel
```

One thing I noticed is that the *second* bluechi-agent trigger was below conmon. 

```
[root@node~]# pstree
systemd─┬─conmon───systemd─┬─bluechi-agent
        │                  ├─dbus-broker-lau───dbus-broker
        │                  ├─systemd-journal
        │                  └─systemd-logind
        ├─dbus-broker-lau───dbus-broker
        ├─systemd-journal
        ├─systemd-logind
        └─systemd-udevd

# rpm -qf /usr/bin/conmon
conmon-2.1.10-1.el9.x86_64

# ps aux | grep -i conmon
root         386  0.0  0.0   8332  2096 ?        Ss   03:56   0:00 /usr/bin/conmon --api-version 1 -c 3d3b4a8ba9a4380d23ce3c8d7bed1eeae137b4fc68b292d75d2ae89d9240f9d2 -u 3d3b4a8ba9a4380d23ce3c8d7bed1eeae137b4fc68b292d75d2ae89d9240f9d2 -r /usr/bin/crun -b /var/lib/containers/storage/overlay-containers/3d3b4a8ba9a4380d23ce3c8d7bed1eeae137b4fc68b292d75d2ae89d9240f9d2/userdata -p /run/containers/storage/overlay-containers/3d3b4a8ba9a4380d23ce3c8d7bed1eeae137b4fc68b292d75d2ae89d9240f9d2/userdata/pidfile -n qm --exit-dir /run/libpod/exits --full-attach -l journald --log-level warning --runtime-arg --log-format=json --runtime-arg --log --runtime-arg=/run/containers/storage/overlay-containers/3d3b4a8ba9a4380d23ce3c8d7bed1eeae137b4fc68b292d75d2ae89d9240f9d2/userdata/oci-log --conmon-pidfile /run/containers/storage/overlay-containers/3d3b4a8ba9a4380d23ce3c8d7bed1eeae137b4fc68b292d75d2ae89d9240f9d2/userdata/conmon.pid --exit-command /usr/bin/podman --exit-command-arg --root --exit-command-arg /var/lib/containers/storage --exit-command-arg --runroot --exit-command-arg /run/containers/storage --exit-command-arg --log-level --exit-command-arg warning --exit-command-arg --cgroup-manager --exit-command-arg systemd --exit-command-arg --tmpdir --exit-command-arg /run/libpod --exit-command-arg --network-config-dir --exit-command-arg  --exit-command-arg --network-backend --exit-command-arg netavark --exit-command-arg --volumepath --exit-command-arg /var/lib/containers/storage/volumes --exit-command-arg --db-backend --exit-command-arg boltdb --exit-command-arg --transient-store=false --exit-command-arg --runtime --exit-command-arg crun --exit-command-arg --storage-driver --exit-command-arg overlay --exit-command-arg --storage-opt --exit-command-arg overlay.mountopt=nodev,metacopy=on --exit-command-arg --events-backend --exit-command-arg journald --exit-command-arg container --exit-command-arg cleanup --exit-command-arg --rm --exit-command-arg 3d3b4a8ba9a4380d23ce3c8d7bed1eeae137b4fc68b292d75d2ae89d9240f9d2

bluechi-agent                             x86_64                             0.8.0-0.202401311403.gitc0284d7.el9                                                @copr:copr.fedorainfracloud.org:group_centos-automotive-sig:bluechi-snapshot                         

 qm                                        noarch                             101:0.6.2-1.20240131152729234993.main.4.gf58cc87.el9                               @copr:copr.fedorainfracloud.org:rhcontainerbot:qm                                                         
```

**Comment by dougsland** [comment]
cc @Yarboa

**Comment by dougsland** [comment]
further investigation confirmed it's QM bluechi-agent showing into the node1 containers as well (as expected), no bug here.
